{
  "schemaVersion": "openacp-authority-charter.v1",
  "artifactType": "authority-charter",
  "charterId": "CHARTER-DOCS-LANE",
  "grantedRole": "frontier",
  "authorityLevel": "B2",
  "allowedActions": ["Read source pack.", "Prepare docs-only task cards.", "Dispatch docs-only workers.", "Consume child handoffs as provisional evidence."],
  "forbiddenActions": ["Modify runtime.", "Claim final acceptance.", "Merge or publish documentation."],
  "delegationRules": ["Downstream workers need task card, scope, verification, and handoff path.", "Reviewers remain read-only."],
  "finalAuthorityReservedTo": "Primary or human owner",
  "scopeLimits": ["Documentation lane only.", "No dependency changes.", "No publication."],
  "dataRiskLimit": "low",
  "resourceUseLimit": ["Local coordination artifacts and local verification only."],
  "allowedInputs": ["Source pack, assigned CARDs, lane backlog, task cards, child handoffs, and reviewer reports."],
  "allowedOutputs": ["Lane backlog, child prompt records, task cards, provisional consume results, handoffs, and Primary-ready packet."],
  "forbiddenSideEffects": ["Runtime edits by Frontier.", "Credential use.", "Publication.", "Merge or release."],
  "stopConditions": ["A remaining gap is B3-only.", "Lane scope is contradicted.", "Data risk exceeds low."],
  "expiresWhen": "The documentation lane is closed or final authority revokes the charter."
}
