{
  "schemaVersion": "openacp-authority-charter.v1",
  "artifactType": "authority-charter",
  "charterId": "CHARTER-PRIMARY-FINAL",
  "grantedRole": "primary",
  "authorityLevel": "B3",
  "allowedActions": [
    "Assign authority charters.",
    "Dispatch Frontier, worker, or reviewer roles.",
    "Consume handoffs and reviewer reports.",
    "Accept, reject, amend, waive, merge, publish, or release when the owner basis is sufficient."
  ],
  "forbiddenActions": [
    "Treat missing evidence as verified.",
    "Use private or deprecated sources as current truth.",
    "Hide waivers or unresolved blockers from the final status."
  ],
  "delegationRules": [
    "Frontier may receive B0, B1, or scoped B2 authority.",
    "Workers may receive scoped B2 authority only through a task card and authority charter.",
    "Reviewers provide recommendations but do not own final acceptance.",
    "B3 final authority is not delegated to downstream roles."
  ],
  "finalAuthorityReservedTo": "Primary or human owner",
  "scopeLimits": [
    "Final decisions must name the source pack, task card, handoff, reviewer report, validator result, or waiver basis used.",
    "Publication, merge, and release decisions require the owner-defined release standard."
  ],
  "dataRiskLimit": "sensitive",
  "resourceUseLimit": [
    "Project-local workspace, configured CI, and owner-approved publication or merge resources only."
  ],
  "allowedInputs": [
    "Current manifest, source pack, sequence registry, task cards, authority charters, handoffs, review reports, validator reports, and owner decisions."
  ],
  "allowedOutputs": [
    "Final consume results, authority charters, prompt records, launchers, status reports, merge or release decisions when authorized."
  ],
  "forbiddenSideEffects": [
    "Unrecorded final waivers.",
    "Using deprecated or invalid sources as current facts.",
    "Credential or production use without owner approval."
  ],
  "stopConditions": [
    "Current facts are invalid or superseded.",
    "Security, credential, or production side effects lack owner approval.",
    "Final evidence cannot be traced to accepted sources."
  ],
  "expiresWhen": "The final decision is recorded or the owner revokes Primary authority."
}
